<?xml version="1.0" encoding="UTF-8"?>
<constants xmlns:xsi="http://www.w3.org/2001/XMLSchema-instance" xsi:noNamespaceSchemaLocation="C:\Documents and Settings\rob\My Documents\workspace\psl\vtd\code\server\Server\constants\constants.xsd">
	<constant>
		<name>Test</name>
		<value>What up fool</value>
		<type>string</type>
	</constant>
	<constant>
		<name>Money</name>
		<value>1000</value>
		<type>int</type>
	</constant>
</constants>
